{
  "id": "p1",
  "instruction": "Clean up the old files",
  "received_from": "principal",
  "slots": {
    "goal": {
      "value": "remove obsolete files",
      "provenance": "stated"
    },
    "means": {
      "value": null,
      "provenance": "missing"
    },
    "procedure": {
      "value": "delete",
      "provenance": "inferred"
    },
    "eligibility": {
      "value": null,
      "provenance": "missing"
    },
    "deferred_effect": {
      "value": null,
      "provenance": "missing"
    },
    "binding_force": {
      "value": "a request from the owner of the session",
      "provenance": "inferred"
    }
  },
  "letter_purpose_divergence": false,
  "decision": "ask",
  "parsed_at": "2026-10-22T09:02:00Z"
}
